{
  "rule_id": "no_uniform_area_entrance",
  "description": "Detect person not wearing uniform in restricted entrance area",
  "method": "composite",
  "detection": {
    "prompt_positive": "person . helmet . hard hat . safety helmet",
    "prompt_negative": null,
    "box_threshold": 0.35,
    "text_threshold": 0.25
  },
  "conditions": {
    "dwell_seconds": 2.0,
    "min_confidence": 0.5,
    "min_frames": 3,
    "require_helmetless": true,
    "inside_roi": {
      "enabled": true,
      "type": "polygon",
      "points": [
        [100, 100],
        [500, 100],
        [500, 800],
        [100, 800]
      ]
    }
  },
  "actions": {
    "cooldown_seconds": 60,
    "record_pre_seconds": 10,
    "record_post_seconds": 10,
    "notify_channels": [
      "slack",
      "email"
    ]
  },
  "metadata": {
    "priority": "high",
    "created_by": "admin",
    "created_at": "2025-01-25"
  }
}